<xs:schema attributeFormDefault="unqualified" elementFormDefault="qualified"
  xmlns:xs="http://www.w3.org/2001/XMLSchema">
  <!-- This file is auto-generated by `mise docgen` - do not edit manually. -->

  <xs:complexType name="urlType">
    <xs:attribute name="src" type="xs:string" use="required"/>
    <xs:attribute name="type" type="xs:string"/>
    <xs:attribute name="description" type="xs:string"/>
  </xs:complexType>

  <xs:complexType name="pronunciationType">
    <xs:choice minOccurs="0" maxOccurs="unbounded">
      <xs:element name="url" type="urlType"/>
    </xs:choice>
    <xs:attribute name="kind" type="xs:string"/>
    <xs:attribute name="value" type="xs:string" use="required"/>
  </xs:complexType>

  <xs:complexType name="translationType">
    <xs:attribute name="lang" type="xs:string" use="required"/>
    <xs:attribute name="value" type="xs:string" use="required"/>
  </xs:complexType>

  <xs:complexType name="exampleType">
    <xs:choice minOccurs="0" maxOccurs="unbounded">
      <xs:element name="translation" type="translationType"/>
      <xs:element name="pronunciation" type="pronunciationType"/>
    </xs:choice>
    <xs:attribute name="value" type="xs:string" use="required"/>
  </xs:complexType>

  <xs:complexType name="noteType">
    <xs:choice minOccurs="0" maxOccurs="unbounded">
      <xs:element name="example" type="exampleType"/>
    </xs:choice>
    <xs:attribute name="id" type="xs:string"/>
    <xs:attribute name="value" type="xs:string" use="required"/>
  </xs:complexType>

  <xs:complexType name="definitionType">
    <xs:choice minOccurs="0" maxOccurs="unbounded">
      <xs:element name="example" type="exampleType"/>
      <xs:element name="note" type="noteType"/>
    </xs:choice>
    <xs:attribute name="id" type="xs:string"/>
    <xs:attribute name="value" type="xs:string" use="required"/>
  </xs:complexType>

  <xs:complexType name="groupType">
    <xs:choice minOccurs="0" maxOccurs="unbounded">
      <xs:element name="definition" type="definitionType"/>
    </xs:choice>
    <xs:attribute name="id" type="xs:string"/>
    <xs:attribute name="description" type="xs:string" use="required"/>
  </xs:complexType>

  <xs:complexType name="formType">
    <xs:choice minOccurs="0" maxOccurs="unbounded">
      <xs:element name="tag" type="xs:string"/>
    </xs:choice>
    <xs:attribute name="kind" type="xs:string"/>
    <xs:attribute name="term" type="xs:string" use="required"/>
  </xs:complexType>

  <xs:complexType name="senseType">
    <xs:choice minOccurs="0" maxOccurs="unbounded">
      <xs:element name="group" type="groupType"/>
      <xs:element name="definition" type="definitionType"/>
      <xs:element name="tag" type="xs:string"/>
      <xs:element name="translation" type="translationType"/>
      <xs:element name="form" type="formType"/>
    </xs:choice>
    <xs:attribute name="pos" type="xs:string"/>
    <xs:attribute name="lemma" type="xs:string"/>
  </xs:complexType>

  <xs:complexType name="etyType">
    <xs:choice minOccurs="0" maxOccurs="unbounded">
      <xs:element name="pronunciation" type="pronunciationType"/>
      <xs:element name="sense" type="senseType"/>
    </xs:choice>
    <xs:attribute name="id" type="xs:string"/>
    <xs:attribute name="description" type="xs:string"/>
  </xs:complexType>

  <xs:complexType name="entryType">
    <xs:choice minOccurs="0" maxOccurs="unbounded">
      <xs:element name="ety" type="etyType"/>
      <xs:element name="media" type="urlType"/>
    </xs:choice>
    <xs:attribute name="term" type="xs:string" use="required"/>
    <xs:attribute name="see" type="xs:string"/>
    <xs:attribute name="rank" type="xs:unsignedInt"/>
  </xs:complexType>

  <xs:complexType name="dictionaryType">
    <xs:choice minOccurs="0" maxOccurs="unbounded">
      <xs:element name="entry" type="entryType"/>
    </xs:choice>
    <xs:attribute name="id" type="xs:string"/>
    <xs:attribute name="name" type="xs:string"/>
  </xs:complexType>

  <xs:element name="dictionary" type="dictionaryType"/>
</xs:schema>
